8718452329830	nl									Spruiten, groene kool en prei stamppot															Jumbo	jumbo	Plantaardige levensmiddelen en dranken, Plantaardige levensmiddelen, Voedsel op basis van fruit en groenten, Groenten, Groentemengsels	en:plant-based-foods-and-beverages,en:plant-based-foods,en:fruits-and-vegetables-based-foods,en:vegetables-based-foods,en:mixed-vegetables			Nederland	en:netherlands			0																						100g	100g																																																																																																				en:vegetables	en:fruits-and-vegetables,en:vegetables		unknown			unknown		1		-5	-15	1	0		
8718452454433	nl									Basis Maaltijdsalade tonijn										450 g				"1 plastic bakje
1 plastic film"	Jumbo	jumbo	Kant-en-klaar maaltijden, Vismaaltijden, Opgemaakte salades, en:Salads with fish, Tonijnsalades	en:meals,en:meals-with-fish,en:prepared-salads,en:salads-with-fish,en:tuna-salad			Nederland	en:netherlands			0																						100g	100g	348	kJ			83	kcal			3.9	g			0.6	g			5.8	g			1.9	g			1.3	g			5.6	g			0.48	g			0.192	g					348	kJ																																																								en:one-dish-meals	en:composite-foods,en:one-dish-meals		unknown	a	-1	unknown				-5	-11	1	0		App - Yuka, Apps
8718452356706	nl									Goudelijk Boter Rozijnen Bollen									2	100g					Jumbo	jumbo	Plantaardige levensmiddelen en dranken, Plantaardige levensmiddelen, Snacks, Granen en aardappels, Zoete snacks, Broden, Viennoiseries, Rozijnenbroden	en:plant-based-foods-and-beverages,en:plant-based-foods,en:snacks,en:cereals-and-potatoes,en:sweet-snacks,en:breads,en:viennoiseries,en:breads-with-raisins			Nederland	en:netherlands			0															rozijnen 4 1% ,tarwebloem, water, bakkersgist, tarwegluten, dextrose, plantaardige oliën (raapzaad, zonnebloem), welpoeder (melk) ,roggezuurdesem (gedroogd), bakkerszout, boterpoeder (melk) 0,5% ,enzymen (_tarwe_), meelverbeteraar: E300, moutbloem (_tarwe_), gedroogde glucosestroop, moutmeel (_tarwe_), kurkumaextract, aroma (vanille), maltodextrine, melkeiwit, erwteneiwit.		Gluten, Melk	en:gluten,en:milk				100g	100g	1200	kJ			287	kcal			2.2	g			0.9	g			56.7	g			28.8	g			3.1	g			7.6	g			0.8	g			0.32	g					1200	kJ																																																								en:pastries	en:sugary-snacks,en:pastries	4	en:4-ultra-processed-food-and-drink-products	c	9	c	44	1	7720	-5	-15	1	0		
8718452216802	nl									Boomgaard appelsap									1000 ml	200 ml				1 glazen fles in de glasbak	Jumbo	jumbo	Plantaardige levensmiddelen en dranken, Dranken, Plantaardige dranken, Vruchtendranken, Sappen en Nectars, Vruchtensappen, Appelsappen	en:plant-based-foods-and-beverages,en:beverages,en:plant-based-beverages,en:fruit-based-beverages,en:juices-and-nectars,en:fruit-juices,en:apple-juices			Nederland	en:netherlands			0															appelsap, antioxidant: E300.							100g	100g	187	kJ			44	kcal			0.1	g			0.1	g			10.3	g			9.8	g			0.2	g			0.1	g			0.1	g			0.04	g					187	kJ																																																								en:fruit-juices	en:beverages,en:fruit-juices	1	en:1-unprocessed-or-minimally-processed-foods	e	12	b	63		2074	-5	-2	0	0		App - yuka, Apps
8718449086807	nl									Cafeïne vrij koffie															Jumbo	jumbo	Plantaardige levensmiddelen en dranken, Dranken, Plantaardige levensmiddelen, Koffies, Gevriesdroogde producten, Oplosdranken, Caffeïnevrije koffies, Plantaardige gevriesdroogde producten, Oploskoffies, Cafeïnevrije oploskoffies, Gevriesdroogde oploskoffies	en:plant-based-foods-and-beverages,en:beverages,en:plant-based-foods,en:coffees,en:freeze-dried-foods,en:instant-beverages,en:decaffeinated-coffees,en:freeze-dried-plant-based-foods,en:instant-coffees,en:decaffeinated-instant-coffees,en:freeze-dried-instant-coffees			Nederland	en:netherlands	Jumbo	jumbo	0															oploskoffie							100g	100g			13	kJ		kcal	3	kcal		g	0.1	g		g	0.1	g		g	0	g		g	0.1	g			0.2	g		g	0.2	g		g	0.1	g		g	0.04	g					13	kJ																																																								1	en:1-unprocessed-or-minimally-processed-foods	c	2	e	6	1	18072	-5	-15	1	0		App - yuka, Apps, App - Open Food Facts
8718452378180	nl									Pindakaas naturel									600 g	15 g	Plastic, Glas	en:plastic,en:glass		"1 glazen pot in glasbak
1 plastic deksel"	Jumbo	jumbo	Plantaardige levensmiddelen en dranken, Plantaardige levensmiddelen, Bonen- en afgeleide producten, Smeerbare producten, Noten en -producten, Plantaardige smeerbare producten, Puree van oliehoudende zaden, Peulvruchtenpastas, Notenpasta's, Pindakazen	en:plant-based-foods-and-beverages,en:plant-based-foods,en:legumes-and-their-products,en:spreads,en:nuts-and-their-products,en:plant-based-spreads,en:oilseed-purees,en:legume-butters,en:nut-butters,en:peanut-butters			België, Nederland	en:belgium,en:netherlands			0															_Pinda_ 85,5%, zonnebloemolie, geheel gehard palmvet, zout.		Pinda	en:peanuts	Noten, Pinda	en:nuts,en:peanuts		100g	100g	2661	kJ			643	kcal			55.2	g			10.2	g			10.2	g			4.9	g			7.6	g			22.6	g			0.59	g			0.236	g					2661	kJ																																																								en:legumes	en:cereals-and-potatoes,en:legumes	3	en:3-processed-foods	c	5	d	38		15202	-5	-4	0	0	-10	App - yuka, Apps, App - InFood, App - Open Food Facts
8718452391561	nl									Melkchocolade									400 g	25 g	Plastic	en:plastic			Jumbo	jumbo	Snacks, Zoete snacks, Cacao en afgeleide producten, Chocoladeproducten, Melkchocoladen	en:snacks,en:sweet-snacks,en:cocoa-and-its-products,en:chocolates,en:milk-chocolates	Duurzame landbouw, UTZ Gecertificeerd, UTZ gecertificeerde cacao	en:sustainable-farming,en:utz-certified,en:utz-certified-cocoa	Nederland	en:netherlands			0															Suiker, cacaoboter, volle MELKpoeder, cacaomassa, emulgator: SOJAlecithine, natuurlijk vanille-aroma.		Melk	en:milk				100g	100g	2308	kJ			554	kcal			35.3	g			21.3	g			50.5	g			49.3	g			3.2	g			6.9	g			0.18	g			0.072	g					2308	kJ																																																								en:chocolate-products	en:sugary-snacks,en:chocolate-products	4	en:4-ultra-processed-food-and-drink-products	e	23	e	19		31004	-5	-10	1	10		App - yuka, Apps, App - Open Food Facts
8718452262113	nl									Runderbouillon															Jumbo	jumbo	Gedroogde producten, Gedroogde producten om te hydrateren, Bouillon, Gevriesdroogde bouillons, Rundvleesbouillons, Bouillonblokjes	en:dried-products,en:dried-products-to-be-rehydrated,en:broths,en:dehydrated-broths,en:beef-broth,en:bouillon-cubes			Nederland	en:netherlands			0																						100g	100g																																																																																																							unknown			unknown		1		-5	-15	1	0		
8718452064366	nl									Sinaasappelsap									1 L	200 ml	Drankencarton	en:brick			Jumbo	jumbo	Plantaardige levensmiddelen en dranken, Dranken, Plantaardige dranken, Vruchtendranken, Sappen en Nectars, Vruchtensappen, Vruchtensappen op basis van concentraat, Sinaasappelsappen, Sinaasappelsappen uit concentraat	en:plant-based-foods-and-beverages,en:beverages,en:plant-based-beverages,en:fruit-based-beverages,en:juices-and-nectars,en:fruit-juices,en:concentrated-fruit-juices,en:orange-juices,en:concentrated-orange-juices			Nederland	en:netherlands			0															Uit sapconcentraat verkregen sinaasappelsap, vitamine C							100g	100g	176	kJ			42	kcal			0.2	g			0.1	g			9.1	g			9.1	g			0.3	g			0.7	g			0.1	g			0.04	g					176	kJ																							20	mg																																en:fruit-juices	en:beverages,en:fruit-juices	1	en:1-unprocessed-or-minimally-processed-foods	e	13	d	36		2011	-5	-10	0	0		App - yuka, Apps
8718452511273	nl									Gele Currynoedels							Gewokte gele curry noedels met groenten en ei			260 g					Jumbo	jumbo	Kant-en-klaar maaltijden	en:meals	Vegetarisch, Beter Leven, Beter Leven 1 ster	en:vegetarian,nl:beter-leven,nl:beter-leven-1-ster	Nederland	en:netherlands			0															gekookte noedels 58% (water, TARWEgriesmeel), groenten 30,3 % (wortel, groene paprika, rode paprika, witte kool, prei, erwten, mais, ui, tomatenpuree), raapzaadolie, scharrelEI 2,2%, water, uienpuree, suiker, zout, azijn, specerijen (fenegriekzaad, kurkuma, chilipeper, komijnzaad, zwarte pepe: kardemom, koriander), natuurlijk aroma, aroma, knoflookpuree, gemalen koko gistextract, conserveermiddel: melkzuur,		Eieren, Gluten, Noten	en:eggs,en:gluten,en:nuts				100g	100g	663	kJ			158	kcal			6	g			0.7	g			21	g			3.4	g			1.8	g			4.1	g			0.66	g			0.264	g					663	kJ																																																								en:one-dish-meals	en:composite-foods,en:one-dish-meals	4	en:4-ultra-processed-food-and-drink-products	b	0	unknown		1		-5	-15	1	0		App - InFood, Apps
8718452445707	nl									Worsenbroodje										80 g					Jumbo	jumbo	Vlezen, Varken	en:meats,en:pork			Nederland	en:netherlands			0															TARWEbloem, varkensvlees Beter Leven 1 ster 26,2%, water, paneermeel (TARWEbloem, water, TARWEzemelen, gist, zout, margarine [plarntaardige oliën (palm, kokos, raapzaad, zonnebloem), water, zout, emulgator: E471, voedingszuur: citroenzuur, kleurstof: carotenen, aroma's, vitaminen: A en D3], GERSTemoutextract), gist, plantaardige oliën (koolzaad, raapzaad), TARWEgluten, suiker, dextrose, gemodificeerd TARWE-eiwit, TARWEzetmeel, zout, gejodeerd zout, SOJAbloem, specerijen (nootmuskaat, zwarte peper), vezels (TARWE, ROGGE), gehydrolyseerd SOJA-eiwit, aroma, MELKeiwit, weipoeder (MELK), lactose (MELK), glucosestroop, tapiocazetmeel, stabilisatoren: E407, E450, E451 en E452, emulgatoren: E339, E471,		Gluten, Melk, Soja	en:gluten,en:milk,en:soybeans	Eieren, Sesamzaad	en:eggs,en:sesame-seeds		100g	100g																																																																																																				en:meat-other-than-poultry	en:fish-meat-eggs,en:meat,en:meat-other-than-poultry	4	en:4-ultra-processed-food-and-drink-products			unknown		1		-5	-15	1	0	-10	App - InFood, Apps
2333337101507	nl									Elzasser							Gerookte Elzasser cervelaat, varkensvleesproduct met rundercollageen							verpakking bij plastic afval	Jumbo	jumbo	Vlezen, Verwerkte vleesproducten, Worsten, Cervelaten	en:meats,en:prepared-meats,en:sausages,en:cervelat	Beter Leven, Beter Leven 1 ster	nl:beter-leven,nl:beter-leven-1-ster	Nederland	en:netherlands			0															varkensvlees Beter Leven 1 ster, zout, varkensvet Beter Leven 1 ster, varkenseiwit, varkenscollageen, rundercollageen, geconcentreerd rode bietensap, specerijen (witte peper, nootmuskaat, gember, cayennepeper, kardemomzaad, uien, paprikapoeder), oregano, natuurlijk aroma, rook, antioxidant: E301, kaliumchloride, conserveermiddel: E250 en E235,							100g	100g	1553	kJ			375	kcal			33	g			12.2	g			0.5	g			0	g							19	g			2.4	g			0.96	g					1553	kJ																																																								en:processed-meat	en:fish-meat-eggs,en:processed-meat	4	en:4-ultra-processed-food-and-drink-products	e	24	e	0		30730	-5	-10	1	0		App - InFood, Apps
8711715880598	de		Bak  Meel zelfrijzend																1pcs						Jumbo	jumbo					Deutschland	en:germany			0																						100g	100g																																																																																																							unknown			unknown		1		-5	-15	1	0		App - Speisekammer, Apps
8718452466627	nl									Tonijn stukken in water									112 g		Blik	en:can			Jumbo	jumbo	Vis en zeevruchten, Conserven, Vis, Vette vissen, Vis in blik, Tonijn, Tonijn in blik	en:seafood,en:canned-foods,en:fishes,en:fatty-fishes,en:canned-fishes,en:tunas,en:canned-tunas	Duurzame visserij, Duurzaam Zeevruchten MSC	en:sustainable-fishing,en:sustainable-seafood-msc	Nederland, Spanje	en:netherlands,en:spain	Jumbo	jumbo	0				Ggevangen in het Midden-westelijk deel en het Midden-oostelijk deel van de Stille Oceaan (FAO 71 en 77) of in Westelijk deel en het Oostelijk deel van de Indische Oceaan (FAO 51 en 57)			MSC-C-51214,ES 12.06648/C CE	msc-c-51214,es-12-06648-c-ec							"Tonijn 70% (_VIS_), water, zout. 

Skipjack tonijn (Katsuwonus pelamis), gevangen in het Midden-westelijk deel en het Midden-oostelijk deel van de Stille Oceaan (FAO 71 en 77) of in Westelijk deel en het Oostelijk deel van de Indische Oceaan (FAO 51 en 57), vangstmethode: ringnetten en kruisnetten."		Vis	en:fish				100g	100g	455	kJ			107	kcal			0.8	g			0.3	g			0	g			0	g			0	g			25	g			1	g			0.4	g					455	kJ																																																								en:fatty-fish	en:fish-meat-eggs,en:fish-and-seafood,en:fatty-fish	3	en:3-processed-foods	b	0	d	39		26053	-2	-10	0	10		App - El CoCo, Apps, App - Open Food Facts
8718452373246	nl									Mexicaanse roerbakmix										600.0g					Jumbo	jumbo	Plantaardige levensmiddelen en dranken, Plantaardige levensmiddelen, Voedsel op basis van fruit en groenten, Groenten, Groentemengsels	en:plant-based-foods-and-beverages,en:plant-based-foods,en:fruits-and-vegetables-based-foods,en:vegetables-based-foods,en:mixed-vegetables			Nederland	en:netherlands			0																						100g	100g					67	kcal			0.699999988079071	g			0.200000002980232	g			8.69999980926514	g			3	g			5.19999980926514	g			3.70000004768372	g													67	kcal																																																								en:vegetables	en:fruits-and-vegetables,en:vegetables		unknown			unknown		1		-5	-15	1	0		
8718452455379	nl									Maaltijdsalade sweet chicken										350.0g					Jumbo	jumbo	Kant-en-klaar maaltijden, Opgemaakte salades	en:meals,en:prepared-salads			Nederland	en:netherlands			0																						100g	100g					125	kcal			8.80000019073486	g			1.10000002384186	g			7.09999990463257	g			3.59999990463257	g			1.60000002384186	g			3.59999990463257	g													125	kcal																																																								en:one-dish-meals	en:composite-foods,en:one-dish-meals		unknown			unknown		1		-5	-15	1	0		
8718452370009	nl									Crunchy Muesli - Appel en Rozijn										30 g	Karton	en:cardboard			Jumbo	jumbo	Plantaardige levensmiddelen en dranken, Plantaardige levensmiddelen, Ontbijten, Granen en aardappels, Granen en graanproducten, Ontbijtgranen, Mueslis, en:Cereals with fruits, Mueslis met fruit	en:plant-based-foods-and-beverages,en:plant-based-foods,en:breakfasts,en:cereals-and-potatoes,en:cereals-and-their-products,en:breakfast-cereals,en:mueslis,en:cereals-with-fruits,en:mueslis-with-fruits			Nederland	en:netherlands			0																						100g	100g	1747	kJ			416	kcal			12.1	g			1.3	g			61.1	g			13.7	g			12.2	g			9.6	g			0.09	g			0.036	g					1747	kJ																																																								en:breakfast-cereals	en:cereals-and-potatoes,en:breakfast-cereals		unknown	a	-1	a	84		32111	-5	-1	0	0		App - yuka, Apps, App - Open Food Facts
8718452397136	nl									Salsa taco															Jumbo	jumbo	Sauzen	en:sauces			Nederland	en:netherlands			0															Tomaat 38,8%, water, tomatenpuree 15%, ui, groene chilipeper 5,2%, gemodificeerd maïszetmeel, specerijen (paprikapoeder, komijn, cayennepeper, chilipeper), azijn, jalapeñopeper 09%, zout, antioxidant: E300, natuurlijk knoflookaroma.							100g	100g																																																																																																				en:dressings-and-sauces	en:fats-and-sauces,en:dressings-and-sauces	3	en:3-processed-foods			unknown		1		-5	-15	1	0		App - InFood, Apps
8718452327133	nl									Ketchup										15 g					Jumbo	jumbo	Sauzen, Tomatensauzen, Ketchups, en:groceries	en:sauces,en:tomato-sauces,en:ketchup,en:groceries			Nederland	en:netherlands			0															tomaten, suiker, azijn, zout, specerijen (uienpoeder, knoflookpoeder, kruidnagel, SELDERIj),		Selderij	en:celery				100g	100g	424	kJ			100	kcal			0	g			0	g			23	g			23	g			1.2	g			1.4	g			1.8	g			0.72	g					424	kJ																																																								en:dressings-and-sauces	en:fats-and-sauces,en:dressings-and-sauces	3	en:3-processed-foods	d	12	b	74	1	11008	-5	-15	1	0		App - yuka, Apps, App - InFood
8718452572397	nl									Chipolata varken									300 g	150.0g	Plastic	en:plastic			Jumbo	jumbo	Vlezen, Verwerkte vleesproducten, Worsten, Franse worsten, Varken, en:Chipolatas	en:meats,en:prepared-meats,en:sausages,en:french-sausages,en:pork,en:chipolatas	Beter Leven, Beter Leven 1 ster	nl:beter-leven,nl:beter-leven-1-ster	Nederland	en:netherlands			0																						100g	100g					251	kcal			19.2000007629395	g			7.19999980926514	g			2.29999995231628	g			0.0399999991059303	g			0.109999999403954	g			16.7000007629395	g													251	kcal																																																								en:processed-meat	en:fish-meat-eggs,en:processed-meat		unknown			e	9		30115	-5	-10	1	0		
8410300207627	fr							Aroma																	Jumbo	jumbo					France	en:france			0																						100g	100g					146	kcal			2.3	g			0.2	g			23	g			5	g							7.5	g			59.8	g			23.92	g					146	kcal																																																														unknown		1		-5	-15	1	0		App - yuka, Apps
7792052153423	en				Crackers															30g					Jumbo	jumbo					Argentina	en:argentina			0																						serving	100g					134	kcal			4.5	g							20	g											4	g													134	kcal																																																											unknown			unknown		1		-5	-15	1	0		App - Waistline, Apps
394214	nl									Coppa di Parma									50 g		Plastic	en:plastic			Jumbo	jumbo	Vlezen, Verwerkte vleesproducten, Capocollo	en:meats,en:prepared-meats,en:coppa	BGA	en:pgi	Nederland	en:netherlands			0																						100g	100g																																																																																																				en:processed-meat	en:fish-meat-eggs,en:processed-meat		unknown			e	-8		28850	-5	-10	1	0		App - Open Food Facts, Apps
2308023102540	nl									Coburger ham gerookt									111 g		Plastic	en:plastic		1 verpakking bij plastic afval	Jumbo	jumbo	Vlezen, Verwerkte vleesproducten, Hammen	en:meats,en:prepared-meats,en:hams			Nederland	en:netherlands			0							NL 635 EG	nl-635-ec							varkensvlees, zout, dextrose, suiker, specerijen (uipoeder, knoflookpoeder, zwarte peper, gember), jeneverbes, kruiden (rozemarijn, marjoraan), specerijenextracten (kaneel, koriander), antioxidant: E301, conserveermiddelen: E250 en E252, rook.							100g	100g	761	kJ			182	kcal			10	g			3.7	g			1	g			1	g			0	g			22	g			5	g			2	g					761	kJ																																																								en:processed-meat	en:fish-meat-eggs,en:processed-meat	4	en:4-ultra-processed-food-and-drink-products	d	15	unknown				-5	-10	1	0		
8718452552825	nl									Houmous									200 g		Plastic	en:plastic		1 plastic bakje	Jumbo	jumbo	Plantaardige levensmiddelen en dranken, Plantaardige levensmiddelen, Smeerbare producten, Plantaardige smeerbare producten, Hartige smeerbare producten, Sauzen, Dipsauzen, Hummus	en:plant-based-foods-and-beverages,en:plant-based-foods,en:spreads,en:plant-based-spreads,en:salted-spreads,en:sauces,en:dips,en:hummus			Nederland	en:netherlands			0																						100g	100g	935	kJ			226	kcal			16.2	g			2	g			9.5	g			0.5	g			5.1	g			6.3	g			0.98	g			0.392	g					935	kJ																																																								en:dressings-and-sauces	en:fats-and-sauces,en:dressings-and-sauces		unknown	a	-1	b	76		25621	-5	-10	1	0		App - Yuka, Apps
8718452541508	nl									Peutermelk 5									2 x 400 g						Jumbo	jumbo	Babyvoeding, Babymelk, Baby-opvolgmelk vanaf 2 jaar	en:baby-foods,en:baby-milks,en:baby-follow-on-milk-from-2-years			Nederland	en:netherlands			0																						100g	100g																																																																																																							unknown			b	74	1	19013	-5	-15	1	0		App - yuka, Apps
8718452504787	nl									pepperoni salami									50g		Plastic	en:plastic		"1 transparante plastic schaal bij plastic afval om te recyclen
1 transparante plastic film bij plastic afval om te recyclen"	Jumbo	jumbo	Vlezen, Verwerkte vleesproducten, Worstjes, Varken, Salamis, Varkensvleessalami, Vleeswaren	en:meats,en:prepared-meats,en:cured-sausages,en:pork,en:salami,en:pork-salami,nl:vleeswaren	Geproduceerd in Italië	en:made-in-italy	Nederland	en:netherlands	jumbo	jumbo	0		Europese Unie	en:european-union		italy	italy	IT 550 l ce	it-550-l-ec							Varkensvlees, zout, dextrose, specerijen (chilipeper, paprika, witte peper), aroma's, antioxidant: E301, conserveermiddelen: E250 en E252.							100g	100g	1590	kJ			384	kcal			32	g			12	g			0.9	g			0.9	g			0	g			23	g			4.2	g			1.68	g					1590	kJ																																																								en:processed-meat	en:fish-meat-eggs,en:processed-meat	4	en:4-ultra-processed-food-and-drink-products	e	24	d	20		30351	-5	-11	1	0		App - Open Food Facts, Apps
8718452245048	nl									Granola										30 g					Jumbo	jumbo	Plantaardige levensmiddelen en dranken, Plantaardige levensmiddelen, Ontbijten, Granen en aardappels, Granen en graanproducten, Ontbijtgranen	en:plant-based-foods-and-beverages,en:plant-based-foods,en:breakfasts,en:cereals-and-potatoes,en:cereals-and-their-products,en:breakfast-cereals			Nederland	en:netherlands			0																						100g	100g	2016	kJ			483	kcal																																					2016	kJ																																																								en:breakfast-cereals	en:cereals-and-potatoes,en:breakfast-cereals		unknown			c	40	1	32135	-5	-15	1	0		
8718452163083	nl									Naturel Pannenkoeken									400g	100g					Jumbo	jumbo	Voedselhulpmiddelen, Dessertmixes, Pannenkoekenmixes	en:cooking-helpers,en:dessert-mixes,de:pfannkuchenmischung			Nederland	en:netherlands			0															Tarwemeel, suiker, volkoren havermeel, rijsmiddelen: E450 en E500, tarwezetmeel, gejodeerd zout.		Gluten	en:gluten	Noten	en:nuts		100g	100g	710	kJ			168	kcal			2.1	g			1.2	g			28.1	g			4.5	g			2.1	g			8.1	g			0.5	g			0.2	g					710	kJ																																																										4	en:4-ultra-processed-food-and-drink-products			unknown		1		-5	-15	1	0		App - Open Food Facts, Apps
8718452611430	en																								Jumbo	jumbo					Germany	en:germany			0																						100g	100g																																																																																																							unknown			unknown		1		-5	-15	1	0		
8718452488261	nl				Gouda  Kaas 48+ jong belegen					JONG BELEGEN									400 g						Jumbo	jumbo					Nederland	en:netherlands			0											gepasteuriseerde melk, zout, zuursel (melk), vegetarisch stremsel, conserveermiddel: E251, kleurstof, carotenen. E = door EU goedgekeurde hulpstof.						Melk	en:milk	en:melk	en:melk		100g	100g					398	kcal			32	g			22.9	g			0	g			0	g							25	g			1.8	g			0.72	g					398	kcal																																																										4	en:4-ultra-processed-food-and-drink-products			unknown		1		-5	-15	1	0		App - Yuka, Apps
8718452539086	nl									American style pancakes chocolate chip										45.0g					Jumbo	jumbo					Nederland	en:netherlands			0																						100g	100g					334	kcal			17.8999996185303	g			4.90000009536743	g			36.2000007629395	g			20.3999996185303	g			1.79999995231628	g			6	g													334	kcal																																																											unknown			unknown		1		-5	-15	1	0		
8718452534210	nl									Snoephartjes									300 g	10g	Plastic	en:plastic		1 plastic zak	Jumbo	jumbo	Snacks, Zoete snacks, Zoetwaren, Snoep	en:snacks,en:sweet-snacks,en:confectioneries,en:candies	Goedgekeurd door EU	nl:goedgekeurd-door-eu	Nederland	en:netherlands			0															Suiker, dextrose, voedingszuur: citroenzuur, rundergelatine, gemodificeerd aardappelzetmeel, natuurlijke aroma's (sinaasappel, citroen, framboos, carthamus), kleurstoffen: carotenen en E163.							100g	100g	1680	kJ			395	kcal			0	g			0	g			98.3	g			98.3	g			0	g			0.5	g			0	g			0	g					1680	kJ																																																								en:sweets	en:sugary-snacks,en:sweets	4	en:4-ultra-processed-food-and-drink-products	d	15	e	19		31003	-5	-10	1	0		App - Open Food Facts, Apps
8718452457939	nl									Rundvleessalade									1 kg	100 g	Plastic	en:plastic		1 plastic bak bij plastic afval	Jumbo	jumbo	Kant-en-klaar maaltijden, Opgemaakte salades	en:meals,en:prepared-salads			Nederland	en:netherlands	Jumbo	jumbo	0															aardappel 53,4%, rundvleesproduct 13,4% (gekookt rundvlees 11,7%, runderbouillon [water, rundvleesextract], zout, gemodificeerd aardappelzetmeel, aardappelzetmeel, conserveermiddel: E250), water, plantaardige oliën (raapzaad, zonnebloem), augurk, suiker, ui, doperwten, wortel 1,8%, azijn, zout, maïszetmeel, vrije uitloopElgeel, tomatenpuree, gemodificeerd maiszetmeel, voedingszuur: melkzuur, conserveermiddelen: E202 en E211, natuurlijke aroma's, gistextract, verdikkingsmiddelen: E412 en E415, maltodextrine, bladSELDERIJ, peterselie, knoflookpoeder, MOSTERDzaad, korianderpoeder, appelextract, rundvleesextract, SOJAbonen, TARWE, limoensapconcentraat, aardappelzetmeel, plantenextracten (ui, wortel, savooiekool, pastinaak).		Selderij, Gluten, Soja	en:celery,en:gluten,en:soybeans	Noten, Pinda	en:nuts,en:peanuts		100g	100g	569	kJ			136	kcal			6.6	g			0.7	g			15.3	g			4.2	g			1.3	g			3.2	g			0.99	g			0.396	g					569	kJ																																																								en:one-dish-meals	en:composite-foods,en:one-dish-meals	4	en:4-ultra-processed-food-and-drink-products	c	3	unknown				-5	-10	1	0		App - InFood, Apps
