2113506005252	en				Salade carpaccio															200.0g					Jumbo	jumbo					Ireland	en:ireland			0																						100g	100g					159	kcal			13.1999998092651	g			2.59999990463257	g			2.20000004768372	g			1.60000002384186	g			0.899999976158142	g			7.30000019073486	g													159	kcal																																																														unknown				-5	-15	1	0		
8410300348030	fr							Bouillon saveur ecrevisse																	Jumbo	jumbo					France	en:france	Auchan	auchan	0		Royaume-Uni	en:united-kingdom								Salt, Wheat Starch, Flavour enhancers (Monosodium Glutamate, Disodium Inosinate And Guanilate), Sugar, Maltodextrine, Shrimp (2%), Flavours (With Fish), Sunflower Oil, Spices, Colour (E160b).						Gluten	en:gluten	Poisson	en:fish		100g	100g					164	kcal			1.3	g			0.2	g			31	g			11	g							7	g			52.8	g			21.12	g					164	kcal																																																														unknown		1		5	-15	1	0		App - yuka, Apps
7792052174428	en				Empanada de verdura con salsa blanca															70.0g					Jumbo	jumbo					Argentina	en:argentina			0																						100g	100g					151	kcal			6	g			1.2	g			22	g							3.2	g			3.3	g													151	kcal																																																														unknown				-5	-15	1	0		
8410300203148	fr							Jumbo Fish Stock																	Jumbo	jumbo					France	en:france			0											Salt, corn starch, flavour enhancers (monosodium glutamate, disodium guanylate and inosinate),  sugar, vegetable protein extract, fish 4.5%, soya flour, sunflower oil,, flavours (with fish), tomato, spices.											100g	100g					628	kcal			2	g			0.2	g			20	g			5.2	g							1.3	g			56.47	g			22.588	g					628	kcal																																																														unknown		1		-5	-15	1	0		App - yuka, Apps
01164381	en				Pan															80.0g					Jumbo	jumbo					United States	en:united-states			0																						100g	100g					241.25	kcal			2.5	g							43.25	g											9.125	g													241.25	kcal																																																											unknown			unknown				-5	-15	1	0		
8718452381364	nl									Stroopkoeken							Stroopkoeken met roomboter		"375 g ℮"	37.5 g	Folie bij plastic afval, Overig bij restafval	nl:folie-bij-plastic-afval,nl:overig-bij-restafval			Jumbo	jumbo					Frankrijk	en:france			0																						100g	100g																																																																																																										unknown				-5	-11	0	0		
8718452358250	es					Cocktail borrel noten																			Jumbo	jumbo					España	en:spain			0																						100g	100g					516	kcal			9.2	g			4.2	g			44.2	g			1.3	g							13.3	g			1.92	g			0.768	g					516	kcal																																																														unknown				-5	-15	1	0		App - yuka, Apps
8718452147816	fr							Vruchtenhagel																	Jumbo	jumbo	Décorations alimentaires	en:food-decorations			France	en:france			0																						100g	100g					380	kcal			0				0				95				93								0														380	kcal																																																														unknown		1		-5	-15	1	0		App - yuka, Apps
2379209102821	en				Runderrookvlees															100.0g					Jumbo	jumbo					Ireland	en:ireland			0																						100g	100g					102	kcal			1	g			0.5	g			1	g			0.899999976158142	g			0.400000005960464	g			22	g													102	kcal																																																														unknown				-5	-15	1	0		
8718452227488	nl							Hagelslag Puur		Hagelslag puur									600 g	20g	Stück	nl:stück			Jumbo	jumbo	"en:Aides culinaires, en:Aides à la pâtisserie, en:Décorations alimentaires, en:Vermicelles multicolores"	en:aides-culinaires,en:aides-a-la-patisserie,en:decorations-alimentaires,en:vermicelles-multicolores			en:Frankrijk, en:Nederland	en:frankrijk,en:nederland			0											Sugar, cocoa mass, skimmed cocoa powder, dextrose, emulsifier: rapeseed lecithin, gloss: gum arabic, chocolate sprinkles: at least 32% cocoa solids,				Suiker, cacaomassa, magere cacaopoeder, dextrose, emulgator: raapzaadlecithine, glansmiddel: arabische gom, Chocoladehagelslag: ten minste 32% cacaobestanddelen,							100g	100g					441	kcal			15	g			8.9	g			68	g			65	g			6.6	g			5.1	g			0.1	g			0.04	g					441	kcal																																																										4	en:4-ultra-processed-food-and-drink-products	d	18	unknown		1		-5	-15	1	0		App - yuka, Apps, App - InFood
2379209002718	en				Runderrookvlees zeezout															97.0g					Jumbo	jumbo					Ireland	en:ireland			0																						100g	100g					102	kcal			1	g			0.5	g			1	g			0.899999976158142	g			0.400000005960464	g			22	g													102	kcal																																																														unknown				-5	-15	1	0		
7702007009989	en				Jumbo mix															60.0g					Jumbo	jumbo					Colombia	en:colombia			0																						100g	100g					500	kcal			30	g			13.3333333333333	g			48.3333333333333	g			31.6666666666667	g			1.66666666666667	g			10	g													500	kcal																																																														unknown				-5	-15	1	0		
8718452296859	nl									Walnoten ongebrande - ongezouten									200g						Jumbo	jumbo	Plantaardige levensmiddelen en dranken, Plantaardige levensmiddelen, Noten en -producten, Noten, Walnoten	en:plant-based-foods-and-beverages,en:plant-based-foods,en:nuts-and-their-products,en:nuts,en:walnuts			Nederland	en:netherlands			0											walnuts				WALNOTEN,		Noten	en:nuts	Noten, Pinda	en:nuts,en:peanuts		100g	100g	2876	kJ			697	kcal			67.2	g			6.9	g			3.2	g			2.3	g			6.4	g			16.7	g			0.05	g			0.02	g					2876	kJ																																																								en:nuts	en:salty-snacks,en:nuts	1	en:1-unprocessed-or-minimally-processed-foods	a	-1	e	16	1	15023	-5	-15	1	0		App - InFood, Apps
8718452486229	nl				Plantaardige schijf Javaanse stijl					Plantaardige schijf Javaanse stijl										100g					Jumbo	jumbo					Nederland	en:netherlands			0											rehydrated protein (soy 50% wheat 14.9%) breadcrumbs (wheat flour, salt, yeast, paprika, turmeric, dye:annatto), onions, sunflower oil, thickeners:e407 and e461, wheat donkey, spices (cumin seed, garlic powder, coriander seed, ginger, turmeric, cayenne pepper, cinnamon, white pepper, fennel seed), wheat starch, salt, yeast extract, wheat flour, vinegar, tomato powder, nutritional acid: citric acid, lavas, minirals: iron (111) difostat and zinc oxide, vitamin : b12, e, eu approved excipients,				Gerehydrateerd eiwit (soja 50% tarwe 14,9%) paneermeel ( tarwebloem, zout, gist, paprikapoeder, kurkuma, kleurstof:annatto), uien, zonnebloemolie, verdikkingsmiddelen:E407 en E461, tarwe ezel, specerijen (komijnzaad, knoflookpoeder, korianderzaad, gember, kurkuma, cayennepeper, kaneel, witte peper, venkelzaad), tarwezetmeel, zout, gistextract, tarwebloem, azijn, tomatenpoeder, voedingzuur: citroenzuur, lavas, miniralen: ijzer (111) difostaat en zinkoxide, vitamine : B12, E ,door EU goedgekeurde hulpstoffen,		Eieren, Gluten, Soja	en:eggs,en:gluten,en:soybeans				serving	100g					168	kcal			6.3	g			0.8	g			13.8	g			1.8	g			5.9	g			11	g			1.22	g			0.488	g					168	kcal																																																										4	en:4-ultra-processed-food-and-drink-products			unknown				-5	-15	1	0		App - waistline, Apps, App - InFood
6133320000451	en				Harira														120 g						Jumbo	jumbo	Meals, Dried products, Dried products to be rehydrated, Soups, Dried meals, Dehydrated soups	en:meals,en:dried-products,en:dried-products-to-be-rehydrated,en:soups,en:dried-meals,en:dehydrated-soups			Algeria	en:algeria			0																						100g	100g																																																																																																				en:one-dish-meals	en:composite-foods,en:one-dish-meals					unknown				-5	-15	1	0		
8410300345534	fr							Jumbo																	Jumbo	jumbo			Halal	en:halal	France	en:france			0														"EU: Sel iodé, Amidon de maïs, Exhausteurs de monosod;que, guanylate et inosinate disodiques), Graisse de céleri), Colorant (caramel El 50d), Sucre, Oignon, Maltodextrine, Epices, 7 Peut contenir traces de blé, poisson, crustacés, lait, œufs."					"Crustacés, Œufs, Poisson, Gluten, Lait"	en:crustaceans,en:eggs,en:fish,en:gluten,en:milk		100g	100g					5	kcal			8	g			5	g			1	g			1	g			2				0	g			5	g			2	g					5	kcal																																																										4	en:4-ultra-processed-food-and-drink-products			unknown		1		-5	-15	1	0		App - yuka, Apps
8718452290277	nl							Kandijkoek		Kandijkoek															Jumbo	jumbo	Snacks, Zoete snacks, Koekjes en cakes, Koekjes	en:snacks,en:sweet-snacks,en:biscuits-and-cakes,en:biscuits			België	en:belgium			0											canoeing ingredients tarwebloem, vegetable oils (palm, rapeseed, coconut), sugar, candy powder 13%, yellow caster sugar (sugar, invert sugar, caramel), candied sugar syrup 2.2%, glucose-fructose syrup, free-range egg, rhyming eggs: e500 and e503, cinnamon, salt, aroma, caramelized sugar, e, eu-approved additive, allergens wheat (gluten), egg, may contain traces of peanuts, milk and nuts, average nutritional value per 100 g per 24 g ri* energy kj				Kandijkoeken Ingrediënten TARWEbloem, plantaardige oliën (palm, raapzaad, kokos), suiker, kandijpoeder 13%, gele basterdsuiker (suiker, invertsuiker, karamel), kandijsuikerstroop 2,2%, glucose-fructosestroop, scharrelEI, rijsmiddelen: E500 en E503, kaneel, zout, aroma, gekaramelliseerde suiker, E , door EU goedgekeurde hulpstof, Allergenen Tarwe (gluten), ei, Kan sporen bevatten van pinda's, melk en noten, Gemiddelde voedingswaarde per 100 g per 24 g RI* Energie kJ		Eieren, Gluten	en:eggs,en:gluten	Melk, Noten	en:milk,en:nuts		100g	100g					496	kcal			21	g			9.3000001907349	g			71	g			41	g							5.5	g			0.75999999046326	g			0.303999996185304	g					496	kcal																																																								en:biscuits-and-cakes	en:sugary-snacks,en:biscuits-and-cakes	4	en:4-ultra-processed-food-and-drink-products	e	27	d	28		24000	-5	-15	1	0	-10	App - yuka, Apps, App - InFood
8718452469314	de		Korinthen																200g						Jumbo	jumbo					Deutschland	en:germany			0																						100g	100g																																																																																																										unknown				-5	-15	1	0		
2243741002300	nl									Kipfilet ovengebakken									100 g						Jumbo	jumbo	Beleg	nl:beleg			Moldavië	en:moldova			0		en:kip	en:kip																		off	100g	100g																																																																																																										unknown				-5	-15	1	0		App - Open Food Facts, Apps
8718452387816	nl									Bokkenpootjes							Luchtige koek met crèmevulling (16%) en cacaofantasiedecoratie (33%)		200 g	12.5 g	Verpakking bij plastic afval	nl:verpakking-bij-plastic-afval			Jumbo	jumbo	Snacks, Zoete snacks, Koekjes en cakes, Koekjes	en:snacks,en:sweet-snacks,en:biscuits-and-cakes,en:biscuits			Frankrijk	en:france			0																						100g	100g	2152	kJ			514	kcal			23.9	g			13.6	g			69.5	g			50.5	g			1.9	g			4.2	g			0.08	g			0.032	g					2152	kJ																																																								en:biscuits-and-cakes	en:sugary-snacks,en:biscuits-and-cakes			e	25	c	43		24000	-5	-10	1	0		
8718452335367	es					Cornichons																			jumbo	jumbo	Alimentos y bebidas de origen vegetal, Alimentos de origen vegetal, Conservas, Frutas y verduras y sus productos, Alimentos de origen vegetal en conserva, Encurtidos, Verduras y hortalizas y sus productos, Verduras y hortalizas en conserva, Vegetales encurtidos, Verduras y hortalizas encurtidas, Pepinos encurtidos, Pepinillos	en:plant-based-foods-and-beverages,en:plant-based-foods,en:canned-foods,en:fruits-and-vegetables-based-foods,en:canned-plant-based-foods,en:pickles,en:vegetables-based-foods,en:canned-vegetables,en:plant-based-pickles,en:vegetable-pickles,en:pickled-cucumbers,en:gherkins			España	en:spain			0																						100g	100g																																																																																																				en:vegetables	en:fruits-and-vegetables,en:vegetables					unknown				-5	-15	1	0		App - yuka, Apps
8718449029804	nl									Spaghetti naturel							Deeegwaar		500 g	200 g	Plastic film	nl:plastic-film			Jumbo	jumbo	Plantaardige levensmiddelen en dranken, Plantaardige levensmiddelen, Granen en aardappels, Granen en graanproducten, Pasta, Gedroogde pastas, Spaghettis	en:plant-based-foods-and-beverages,en:plant-based-foods,en:cereals-and-potatoes,en:cereals-and-their-products,en:pastas,en:dry-pastas,en:spaghetti			Nederland	en:netherlands			0															Harde tarwemeel. Allergenen: tarwe (gluten).		Gluten	en:gluten				100g	100g			600	kJ			142	kcal			0.6	g							28.8	g											4.7	g													600	kJ																																																						en:cereals	en:cereals-and-potatoes,en:cereals					b	68		9810	-5	-1	0	0		
8711715871107	nl									Risotto rijst										157 g				Papier kartin kringloop	Jumbo	jumbo	Plantaardige levensmiddelen en dranken, Plantaardige levensmiddelen, Granen en aardappels, Zaden, Granen en graanproducten, Graankorrels, Rijst	en:plant-based-foods-and-beverages,en:plant-based-foods,en:cereals-and-potatoes,en:seeds,en:cereals-and-their-products,en:cereal-grains,en:rices			Nederland	en:netherlands	Jumbo	jumbo	0															Rondgraanrijst 100%.							100g	100g	767	kJ			182	kcal			4.9	g			0.9	g			31.6	g			0.1	g			0.7	g			2.9	g			0.5	g			0.2	g					767	kJ			3.5	g			0.3	g																																																en:cereals	en:cereals-and-potatoes,en:cereals			c	3	b	68		9101	-5	-1	0	0		
8718449032361	nl									Doperwten-wortelen							doperwten-wortelen extra fijn		180 g, 120 g uitlekgewicht		Deksel overig, Glazen pot, Metalen deksel, Pot glasbak	nl:deksel-overig,nl:glazen-pot,nl:metalen-deksel,nl:pot-glasbak			Jumbo	jumbo	Plantaardige levensmiddelen en dranken, Plantaardige levensmiddelen, Conserven, Voedsel op basis van fruit en groenten, Conserven Producten in blik, Groenten, Groenten in blik	en:plant-based-foods-and-beverages,en:plant-based-foods,en:canned-foods,en:fruits-and-vegetables-based-foods,en:canned-plant-based-foods,en:vegetables-based-foods,en:canned-vegetables			Nederland	en:netherlands			0															Groenten in wisselende verhouding (doperwten, wortelen), water, suiker, zout							100g	100g	207	kJ			49	kcal			0.6	g			0.1	g			6.2	g			2.6	g			4	g			2.8	g			0.4	g			0.16	g					207	kJ																																																								en:vegetables	en:fruits-and-vegetables,en:vegetables	3	en:3-processed-foods	a	-9	unknown				-5	-4	0	0		
8718452148929	nl									Rode kool									190 g		Deksel overig, Glazen pot, Metalen deksel, Pot glasbak	nl:deksel-overig,nl:glazen-pot,nl:metalen-deksel,nl:pot-glasbak			Jumbo	jumbo	Rode kool met appel	nl:rode-kool-met-appel			Nederland	en:netherlands			0															Rode kool 76,3%, water, suiker, appelmoes 4,8%, appelstukjes 2,6%, azijn, gemodificeerd maiszetmeel, zout.							100g	100g	241	kJ			57	kcal			0.3	g			0	g			11.9	g			10.2	g			1.9	g			0.7	g			0.6	g			0.24	g					241	kJ																																																										3	en:3-processed-foods	a	-2	unknown				-5	-4	0	0		
87328196	nl									Italiaanse kruiden									13 g		en:Recycle, Recyclen in de glasbak, Glazen potje, Plastic dop	en:recycle,en:recycle-in-glass-bin,nl:glazen-potje,nl:plastic-dop			Jumbo	jumbo	Plantaardige levensmiddelen en dranken, Plantaardige levensmiddelen, en:groceries, Smaakmakers, Plantaardige smaakmakers, Aromatische planten, Kruidenmelanges	en:plant-based-foods-and-beverages,en:plant-based-foods,en:groceries,en:condiments,en:culinary-plants,en:aromatic-plants,en:mixtures-of-aromatic-plants			Nederland	en:netherlands			0															Basilicum 56%, tijm 22%, oregano 12%, bonenkruid 10%.						on	100g	100g																																																																																																						1	en:1-unprocessed-or-minimally-processed-foods			unknown				-5	-3	0	0		
8718452130771	nl									Super kruidnoten							Roomboter kruidnoten		300 g		Plastic zak	nl:plastic-zak		Sluitclip bij restafval, overig bij plastic afval	Jumbo	jumbo	Snacks, Zoete snacks, Koekjes en cakes, Koekjes	en:snacks,en:sweet-snacks,en:biscuits-and-cakes,en:biscuits			Nederland	en:netherlands	Jumbo	jumbo	0															"_Tarwebloem_, suiker, roomboter 21,8% (_melk_), water, stroop (glucose, fructose, sacharose, specerijen (kaneel, kruidnagel, gember, koriander, foelie, nootmuskaat, piment, kardemom), roggebloem, sojameel, glucose-fructosestroop, suikerstroop, rijsmiddelen: E500 en É503, zout,_ scharrelei_, lupinemeel."		Eieren, Gluten, Melk	en:eggs,en:gluten,en:milk	Eieren, Gluten, Lupine, Melk, Soja	en:eggs,en:gluten,en:lupin,en:milk,en:soybeans		100g	100g	1981	kJ			473	kcal			21.1	g			12.5	g			65.2	g			29.5	g			1.5	g			4.7	g			0.6	g			0.24	g					1981	kJ																																																								en:biscuits-and-cakes	en:sugary-snacks,en:biscuits-and-cakes	4	en:4-ultra-processed-food-and-drink-products	e	22	d	38		24000	-5	-15	2	0		
2243951002817	nl									Fricandeau naturel															Jumbo	jumbo					Nederland	en:netherlands			0															Varkensulees 98%, zout, voedingszuur: E325, specerijen. E = Door EU goedgekeurde huipstoffen							100g	100g																																																																																																						4	en:4-ultra-processed-food-and-drink-products			unknown		1		-5	-15	1	0		
8711715807939	nl									Extra jam bosvruchten										15 g					Jumbo	jumbo					Nederland	en:netherlands			0															Vruchten (aardbei 14%, braam 12%, framboos 10%, bosbes 9%, vlierbes 5%), suiker, glucose-fructosestroop, geleermiddel: pectinen, voedingszuur: citroenzuur.							100g	100g	1052	kJ			248	kcal			0.2	g			0	g			60	g			60	g			2	g			0.5	g			0.1	g			0.04	g					1052	kJ																																																	50	%								4	en:4-ultra-processed-food-and-drink-products			unknown		1		-5	-15	1	0		App - InFood, Apps
7792052040242	es																			60g					Jumbo	jumbo					España	en:spain			0																						serving	100g	398	kJ			95	kcal			3	g			1	g															17	g			610	mg			244	mg					398	kJ																																																														unknown		1		-5	-15	1	0		App - elcoco, Apps, App - El CoCo
8718452422609	en				Kapucijnen															250.0g					Jumbo	jumbo					Netherlands	en:netherlands			0																						100g	100g					85	kcal			0.699999988079071	g			0.100000001490116	g			10	g			0.899999976158142	g			6.09999990463257	g			6.69999980926514	g													85	kcal																																																														unknown				-5	-15	1	0		
8718449092709	nl																		250 g						Jumbo	jumbo	Zuivelproducten, Romen, Slagromen	en:dairies,en:creams,en:whipped-creams			Nederland	en:netherlands	Jumbo	jumbo	0											whipped cream (milk), sugar 8.5%, drifgases: e942 and e941, emulsifier: e471, stabilizer: f407, natural vanilla flavouring, e, eu approved excipient, allergens: milk,				Slagroom (MELK), suiker 8,5%, drifgasen: E942 en E941, emulgator: E471, stabilisator: F407, natuurlijk vanille-aroma, E, door EU goedgekeurde hulpstof, Allergenen: melk,		Melk	en:milk				100g	100g																																																																																																				en:milk-and-yogurt	en:milk-and-dairy-products,en:milk-and-yogurt	4	en:4-ultra-processed-food-and-drink-products			c	50	1	19430	-5	-15	1	0		Scanparty - Rotterdam - 2019-04, App - InFood, Apps
8718452362851	en		Macadamia Mix		Mix macadamia																				Jumbo	jumbo	Plant-based foods and beverages, Plant-based foods, Nuts and their products, Nuts, Macadamia nuts	en:plant-based-foods-and-beverages,en:plant-based-foods,en:nuts-and-their-products,en:nuts,en:macadamia-nuts			Germany, Ireland	en:germany,en:ireland			0																						100g	100g	2683	kJ			648	kcal			53	g			7.5	g			22	g			4	g			7.4	g			17	g			1.2	g			0.48	g					2683	kJ																																																								en:nuts	en:salty-snacks,en:nuts			d	15	e	17		15027	-5	-15	1	0		App - yuka, Apps, App - Speisekammer
8718452142521	nl									Appelstroop															Jumbo	jumbo					Nederland	en:netherlands			0																						100g	100g					274	kcal			0.1	g			0	g			66	g			58	g							0	g													274	kcal																																																														unknown				-5	-15	1	0		App - yuka, Apps
8718452492619	en				Salmon														260g						Jumbo	jumbo					Netherlands	en:netherlands			0																						100g	100g																																																																																																										unknown				-5	-15	1	0		
8410300351139	es																								Jumbo	jumbo					España	en:spain			0																						100g	100g																																																																																																										unknown				-5	-15	1	0		App - El CoCo, Apps
8718452307388	es					Stroori																			Jumbo	jumbo			Agricultura sustentable, Certificado UTZ	en:sustainable-farming,en:utz-certified	España	en:spain			0																						100g	100g					1500	kcal			12.3	g			7.2	g			75.6	g			73.6	g							4.4	g			0.1	g			0.04	g					1500	kcal																																																														unknown				-5	-15	1	10		App - yuka, Apps
8718452513673	nl									Franse Kwark Mager										250g					Jumbo	jumbo	Zuivelproducten, Desserts, Gefermenteerde levensmiddelen, Gefermenteerde zuivelproducten, Desserts op basis van melk, en:quark, Magere kwark	en:dairies,en:desserts,en:fermented-foods,en:fermented-milk-products,en:dairy-desserts,en:quark,en:lean-quark			Nederland	en:netherlands			0											grazing milk from koeie that is at least 120 days per yes at least 6 hours per day in the w lean cottage cheese best before: see lid, storage advice: keep cool (mar 7°c), after opening limited shelf life, consumer service: jumbo supermarkets b,v,, antwoordnumme 10072, 5460 vb veghel, netherlands, jumbo,com it is important a varied, eye-on food and a healthy				WEIDEMELK AFKOMSTIG VAN KOEIE DIE TEN MINSTE 120 DAGEN PER JA MINIMAAL 6 UUR PER DAG IN DE W Magere kwark Ten minste houdbaar tot en met: zie deksel, Bewaaradvies: gekoeld bewaren (mar 7°C), Na openen beperkt houdbaar, Consumentenservice: Jumbo Supermarkten B,V,, Antwoordnumme 10072, 5460 VB Veghel, Nederland, Jumbo,com Het is van belang een gevarieerde, Eyenwichtige voeding en een gezonde							100g	100g									0.5	g							4.4	g			4.4	g			0.5	g			9	g			0.11	g			0.044	g			0	% vol																																																										en:dairy-desserts	en:milk-and-dairy-products,en:dairy-desserts					unknown				-5	-15	1	0		App - InFood, App - Open Food Facts, Apps
8718452405299	es					Slangen																			Jumbo	jumbo			Vegetariano, Vegano	en:vegetarian,en:vegan	España	en:spain			0																						100g	100g					1433	kcal			0.10000000149012	g			0.10000000149012	g			82.699996948242	g			54.700000762939	g							0.10000000149012	g			0.25999999046326	g			0.103999996185304	g					1433	kcal																																																														unknown				-5	-15	1	0		App - yuka, Apps
8718452142286	en							Bloemen Honing																	Jumbo	jumbo					France	en:france			0											flower honey											100g	100g																																																																																																										unknown		1		-5	-15	1	0		App - yuka, Apps, App - InFood
8718449023536	nl									Digestive biscuit															Jumbo	jumbo	Snacks, Zoete snacks, Koekjes en cakes, Koekjes	en:snacks,en:sweet-snacks,en:biscuits-and-cakes,en:biscuits			Nederland	en:netherlands			0																						100g	100g					492	kcal			21.2	g			1.8	g			66.6	g			19.8	g							6.7	g			1.2	g			0.48	g					492	kcal																																																								en:biscuits-and-cakes	en:sugary-snacks,en:biscuits-and-cakes			d	16	d	38	1	24000	-5	-15	1	0		App - yuka, Apps
8410300348535	fr							"Bouillon saveur bœuf"																	Jumbo	jumbo	"en:groceries, Produits déshydratés, Produits lyophilisés à reconstituer, Bouillons, Bouillons de bœuf"	en:groceries,en:dried-products,en:dried-products-to-be-rehydrated,en:broths,en:beef-broth			France	en:france			0														"Sel, Amidon de mai', Exhausteurs de goût (E621, E635), Graisse végétale de palme, Extrait de protéines végétales de soja, Colorant (E150d), maltodextrine, arômes (dont traces de blé), oignon, épices, extrait de viande de bœuf. Peut contenir traces de œuf, céleri, lait, crustacés, poisson."					"Céleri, Crustacés, Œufs, Poisson, Gluten, Lait"	en:celery,en:crustaceans,en:eggs,en:fish,en:gluten,en:milk		100g	100g					179	kcal			10	g			6.5	g			16	g			1.7	g			0.3				6.2	g			59.25	g			23.7	g					179	kcal																																																										4	en:4-ultra-processed-food-and-drink-products			unknown		1		-5	-15	1	0	-10	App - yuka, Apps
8718452182978	en																								Jumbo	jumbo					Germany, Ireland	en:germany,en:ireland			0																						100g	100g																																																																																																										unknown				-5	-15	1	0		App - Speisekammer, Apps
87341928	en																								Jumbo	jumbo					Germany, Ireland	en:germany,en:ireland			0																						100g	100g																																																																																																										unknown				-5	-15	1	0		App - Speisekammer, Apps
8718452156610	en																								Jumbo	jumbo					Germany, Ireland	en:germany,en:ireland			0																						100g	100g																																																																																																										unknown				-5	-15	1	0		App - Speisekammer, Apps
